{
  "id": "orbital-superiority",
  "title": "Orbital Superiority",
  "wave": "system-gateway",
  "nrdbCode": "30068",
  "type": "agenda",
  "side": "corp",
  "advancementRequirement": 4,
  "agendaPoints": 2,
  "subtypes": [
    "security"
  ],
  "onScore": {
    "op": "if",
    "cond": {
      "op": "runner_tagged"
    },
    "then": {
      "op": "do",
      "action": {
        "kind": "meat_damage",
        "amount": 4
      }
    },
    "else": {
      "op": "do",
      "action": {
        "kind": "give_tags",
        "amount": 1
      }
    }
  },
  "unsupported": []
}
