{
  "id": "sprint",
  "title": "Sprint",
  "wave": "system-gateway",
  "nrdbCode": "30041",
  "type": "operation",
  "side": "corp",
  "playCost": 0,
  "onPlay": {
    "op": "seq",
    "effects": [
      {
        "op": "do",
        "action": {
          "kind": "draw",
          "side": "corp",
          "amount": 3
        }
      },
      {
        "op": "do",
        "action": {
          "kind": "shuffle_hq_to_rd",
          "amount": 2
        }
      }
    ]
  },
  "unsupported": []
}
