{
  "id": "public-trail",
  "title": "Public Trail",
  "wave": "system-gateway",
  "nrdbCode": "30057",
  "type": "operation",
  "side": "corp",
  "playCost": 4,
  "subtypes": [
    "gray ops"
  ],
  "onPlay": {
    "op": "choose",
    "chooser": "runner",
    "options": [
      {
        "id": "pay8",
        "label": "Pay 8\u00a2",
        "effect": {
          "op": "do",
          "action": {
            "kind": "lose_credits",
            "side": "runner",
            "amount": 8
          }
        }
      },
      {
        "id": "tag",
        "label": "Take 1 tag",
        "effect": {
          "op": "do",
          "action": {
            "kind": "give_tags",
            "amount": 1
          }
        }
      }
    ]
  },
  "unsupported": [
    "Play only if successful run last turn \u2014 play restriction not enforced."
  ]
}
