{
  "id": "egret",
  "title": "Egret",
  "wave": "system-update-2021",
  "nrdbCode": "31032",
  "type": "program",
  "side": "runner",
  "unsupported": [
    "Install only on rezzed ice; host gains barrier+code gate+sentry — installOnIce exists; subtype grant not yet applied to interface."
  ],
  "subtypes": [
    "trojan"
  ],
  "installCost": 2,
  "memoryCost": 1,
  "installOnIce": true,
  "hostGainsAllIceSubtypes": true
}
