{
  "id": "haas-bioroid-precision-design",
  "title": "Haas-Bioroid: Precision Design",
  "wave": "system-gateway",
  "nrdbCode": "30035",
  "type": "identity",
  "side": "corp",
  "handSizeBonus": 1,
  "unsupported": [],
  "subtypes": [
    "megacorp"
  ],
  "onAgendaScored": {
    "op": "choose",
    "chooser": "corp",
    "options": [
      {
        "id": "from-archives",
        "label": "Add 1 card from Archives to HQ",
        "effect": {
          "op": "do",
          "action": {
            "kind": "archives_to_hq",
            "amount": 1
          }
        }
      },
      {
        "id": "decline",
        "label": "Decline",
        "effect": {
          "op": "do",
          "action": {
            "kind": "gain_credits",
            "side": "corp",
            "amount": 0
          }
        }
      }
    ]
  }
}
