{
  "id": "fermenter",
  "title": "Fermenter",
  "wave": "system-gateway",
  "nrdbCode": "30007",
  "type": "program",
  "side": "runner",
  "installCost": 1,
  "subtypes": [
    "virus"
  ],
  "onInstall": {
    "op": "do",
    "action": {
      "kind": "add_virus_counter",
      "amount": 1
    }
  },
  "onTurnBegin": {
    "op": "do",
    "action": {
      "kind": "add_virus_counter",
      "amount": 1
    }
  },
  "paidAbilities": [
    {
      "id": "fermenter-cash",
      "label": "Trash: gain 2\u00a2 per virus",
      "clickCost": 1,
      "creditCost": 0,
      "cost": {
        "clicks": 1,
        "trashSelf": true
      },
      "windows": [
        "runner_action_paw"
      ],
      "effect": {
        "op": "do",
        "action": {
          "kind": "gain_credits_per_virus",
          "per": 2
        }
      }
    }
  ],
  "unsupported": []
}
