{
  "id": "retrieval-run",
  "title": "Retrieval Run",
  "wave": "system-update-2021",
  "nrdbCode": "31004",
  "type": "event",
  "side": "runner",
  "unsupported": [],
  "subtypes": [
    "run"
  ],
  "playCost": 3,
  "runEvent": {
    "servers": "archives",
    "skipBreachInstallProgramFromHeap": true
  }
}
