{
  "id": "pennyshaver",
  "title": "Pennyshaver",
  "wave": "system-gateway",
  "nrdbCode": "30014",
  "type": "hardware",
  "side": "runner",
  "installCost": 3,
  "subtypes": [
    "console"
  ],
  "paidAbilities": [
    {
      "id": "pennyshaver-take",
      "label": "Place 1¢ then take all",
      "clickCost": 1,
      "creditCost": 0,
      "cost": {
        "clicks": 1
      },
      "windows": [
        "runner_action_paw"
      ],
      "effect": {
        "op": "seq",
        "effects": [
          {
            "op": "do",
            "action": {
              "kind": "place_hosted_credits",
              "amount": 1
            }
          },
          {
            "op": "do",
            "action": {
              "kind": "take_hosted_credits",
              "amount": 99
            }
          }
        ]
      }
    }
  ],
  "unsupported": [],
  "muBonus": 1,
  "onSuccessfulRun": {
    "op": "do",
    "action": {
      "kind": "place_hosted_credits",
      "amount": 1
    }
  }
}
