{
  "id": "spin-doctor",
  "title": "Spin Doctor",
  "wave": "system-gateway",
  "nrdbCode": "30053",
  "type": "asset",
  "side": "corp",
  "installCost": 0,
  "rezCost": 0,
  "trashCost": 2,
  "subtypes": [
    "character"
  ],
  "onRez": {
    "op": "do",
    "action": {
      "kind": "draw",
      "side": "corp",
      "amount": 2
    }
  },
  "unsupported": [],
  "paidAbilities": [
    {
      "id": "spin-doctor-rfg",
      "label": "Trash: shuffle up to 2 Archives into R&D",
      "clickCost": 0,
      "creditCost": 0,
      "cost": {
        "trashSelf": true
      },
      "windows": [
        "corp_action_paw"
      ],
      "effect": {
        "op": "do",
        "action": {
          "kind": "shuffle_archives_to_rd",
          "amount": 2
        }
      }
    }
  ]
}
