{
  "id": "subliminal-messaging",
  "title": "Subliminal Messaging",
  "wave": "system-update-2021",
  "nrdbCode": "31082",
  "type": "operation",
  "side": "corp",
  "unsupported": [],
  "subtypes": [
    "gray ops"
  ],
  "playCost": 0,
  "onPlay": {
    "op": "seq",
    "effects": [
      {
        "op": "do",
        "action": {
          "kind": "gain_credits",
          "side": "corp",
          "amount": 1
        }
      },
      {
        "op": "do",
        "action": {
          "kind": "gain_clicks",
          "side": "corp",
          "amount": 1
        }
      }
    ]
  },
  "subliminalMessaging": true
}
