{
  "id": "pantograph",
  "title": "Pantograph",
  "wave": "system-gateway",
  "nrdbCode": "30023",
  "type": "hardware",
  "side": "runner",
  "installCost": 2,
  "subtypes": [
    "console"
  ],
  "unsupported": [
    "On score/steal: may install — optional install not implemented."
  ],
  "muBonus": 1,
  "creditsOnScoreOrSteal": 1
}
