{
  "id": "cleaver",
  "title": "Cleaver",
  "wave": "system-gateway",
  "nrdbCode": "30006",
  "type": "program",
  "side": "runner",
  "strength": 3,
  "subtypes": [
    "icebreaker",
    "fracter"
  ],
  "breaker": {
    "breaksSubtype": "barrier",
    "strength": 3,
    "breakCredits": 1,
    "pumpCredits": 2,
    "pumpStrength": 1,
    "breakMaxSubs": 2
  },
  "paidAbilities": [
    {
      "id": "cleaver-pump",
      "label": "Pump Cleaver +1 strength",
      "clickCost": 0,
      "creditCost": 2,
      "cost": {
        "credits": 2
      },
      "windows": [
        "encounter_paw"
      ],
      "effect": {
        "op": "do",
        "action": {
          "kind": "pump_strength",
          "amount": 1
        }
      }
    }
  ],
  "unsupported": [],
  "installCost": 3
}
